{
  "document_schema_version": "1.0.0",
  "evidence_id": "CER_EOP101126_PROJECT_RECORD_2026-09-05",
  "evidence_type": "CER_PUBLIC_RECORD",
  "source": {
    "source_id": "CER_PROJECT_RECORD",
    "publisher": "Clean Energy Regulator",
    "canonical_uri": "https://cer.gov.au/schemes/australian-carbon-credit-unit-scheme/accu-project-and-contract-register/project/EOP101126",
    "accessed_on": "2026-09-05",
    "retrieval_mode": "CURATED_PUBLIC_FACTS",
    "authority_scope": "PUBLIC_REGISTRY_FACTS",
    "source_content_sha256": "e98da272d9fe2a01a1fa6399939b34c8545091ecc63b01a57aa114d3b5f0b70e",
    "source_content_bytes": 151865,
    "redistribution_status": "FACTUAL_EXTRACT_ONLY_NO_RAW_REDISTRIBUTION"
  },
  "subject": {"subject_type": "ACCU_PROJECT", "subject_id": "EOP101126", "name": "AHG Land Transport Emissions Reduction (Revoked)"},
  "facts": [
    {
      "fact_id": "CER_EOP101126.IDENTITY",
      "text": "The CER record identifies EOP101126 as AHG Land Transport Emissions Reduction, a nationwide Transport project.",
      "claim_families": ["REGISTRY_FACTS"],
      "tags": ["registry", "project_identity", "method"],
      "subject_type": "ACCU_PROJECT",
      "subject_id": "EOP101126",
      "authority_scope": "PUBLIC_REGISTRY_FACTS",
      "attributes": {"project_id": "EOP101126", "project_name": "AHG Land Transport Emissions Reduction (Revoked)", "method_type": "Transport", "method": "Carbon Credits (Carbon Farming Initiative-Land and Sea Transport) Methodology Determination 2015", "project_location": "Nation Wide"}
    },
    {
      "fact_id": "CER_EOP101126.TIMING",
      "text": "The CER record lists registration on 9 April 2015 and a crediting period from 10 October 2015 to 9 October 2022; no model start date is listed.",
      "claim_families": ["REGISTRY_FACTS"],
      "tags": ["registry", "timing"],
      "subject_type": "ACCU_PROJECT",
      "subject_id": "EOP101126",
      "authority_scope": "PUBLIC_REGISTRY_FACTS",
      "attributes": {"registration_date": "2015-04-09", "crediting_period_start": "2015-10-10", "crediting_period_end": "2022-10-09", "model_start_date": null}
    },
    {
      "fact_id": "CER_EOP101126.CONTEXT",
      "text": "The record provides no mapping files, lists zero KACCUs issued, and notes revocation under section 30 of the CFI Rule on 15 May 2018.",
      "claim_families": ["REGISTRY_FACTS"],
      "tags": ["registry", "issuance", "mapping_availability", "revoked"],
      "subject_type": "ACCU_PROJECT",
      "subject_id": "EOP101126",
      "authority_scope": "PUBLIC_REGISTRY_FACTS",
      "attributes": {"mapping_file_types": [], "total_kaccus_issued": 0, "total_kaccus_relinquished": 0, "revoked_on": "2018-05-15"}
    }
  ]
}
